{
  "domain": "quillstone.example",
  "name": "Quillstone Analytics",
  "as_of": "2026-10-06",
  "profile": "default",
  "score": 7.5,
  "contributions": [
    {
      "type": "leadership",
      "contribution": 1.9,
      "occurred_at": "2026-10-03",
      "summary": "names as chief financial officer",
      "url": "https://news.google.com/rss/articles/CBMiQUFVX3lxTFBxdWlsbHN0b25lLWNoaWVmLWZpbmFuY2lhbC1vZmZpY2VyLTAwNQ?oc=5"
    },
    {
      "type": "leadership",
      "contribution": 1.9,
      "occurred_at": "2026-10-02",
      "summary": "appoints new chief revenue officer",
      "url": "https://news.google.com/rss/articles/CBMiQUFVX3lxTFBxdWlsbHN0b25lLWNoaWVmLXJldmVudWUtb2ZmaWNlci0wMDI?oc=5"
    },
    {
      "type": "launch",
      "contribution": 1.5,
      "occurred_at": "2026-10-04",
      "summary": "Quillstone Analytics unveils natural-language query assistant - The Data Desk",
      "url": "https://news.google.com/rss/articles/CBMiQUFVX3lxTFBxdWlsbHN0b25lLXF1ZXJ5LWFzc2lzdGFudC0wMDY?oc=5"
    },
    {
      "type": "launch",
      "contribution": 1.3,
      "occurred_at": "2026-09-29",
      "summary": "Quillstone Analytics launches real-time anomaly alerts for retail teams - Retail Tech Wire",
      "url": "https://news.google.com/rss/articles/CBMiQUFVX3lxTFBxdWlsbHN0b25lLWFub21hbHktYWxlcnRzLTAwMw?oc=5"
    },
    {
      "type": "expansion",
      "contribution": 0.9,
      "occurred_at": "2026-09-30",
      "summary": "Quillstone Analytics opens London office to serve European customers - Metro Business Review",
      "url": "https://news.google.com/rss/articles/CBMiQUFVX3lxTFBxdWlsbHN0b25lLWxvbmRvbi1vZmZpY2UtMDA0?oc=5"
    }
  ],
  "open_postings": 0,
  "long_open_roles": 0,
  "sources": {
    "ats": "no_board",
    "edgar_cik": null,
    "news": true
  },
  "generated_by": "https://github.com/karank2512/tell-ai/commit/0123456789abcdef0123456789abcdef01234567",
  "why_not_higher": []
}
