{
  "domain": "greenhouse-fixture.test",
  "name": "Greenhouse Fixture",
  "as_of": "2026-10-06",
  "profile": "default",
  "score": 2.7,
  "contributions": [
    {
      "type": "hiring_velocity",
      "role_family": "sales",
      "contribution": 2.7,
      "occurred_at": "2026-10-02",
      "summary": "3 new sales roles in 7 days vs 0.5 baseline",
      "url": "https://boards.greenhouse.io/tell-fixture",
      "postings": [
        {
          "title": "Account Executive, Mid-Market",
          "posted_at": "2026-09-30",
          "url": "https://boards.greenhouse.io/tell-fixture/jobs/spike-0"
        },
        {
          "title": "Enterprise Account Executive",
          "posted_at": "2026-10-01",
          "url": "https://boards.greenhouse.io/tell-fixture/jobs/spike-1"
        },
        {
          "title": "Sales Development Representative",
          "posted_at": "2026-10-02",
          "url": "https://boards.greenhouse.io/tell-fixture/jobs/spike-2"
        }
      ]
    }
  ],
  "open_postings": 5,
  "long_open_roles": 2,
  "sources": {
    "ats": "greenhouse:tell-fixture",
    "edgar_cik": null,
    "news": false
  },
  "generated_by": "https://github.com/karank2512/tell-ai/commit/0123456789abcdef0123456789abcdef01234567",
  "why_not_higher": []
}
